<objecttype name="sample-dm2" isChild="true" isParent="false" hasDerivates="true" xmlns:xs="http://www.w3.org/2001/XMLSchema"
  xmlns:xsi="http://www.w3.org/2001/XMLSchema-instance" xsi:noNamespaceSchemaLocation="datamodel.xsd">
  <metadata>

    <element name="metaText" type="text" style="small" minOccurs="1" notinherit="ignore" heritable="ignore" />
    
    <element name="metaXML" type="xml" style="dontknow" maxOccurs="unbounded" notinherit="ignore" heritable="ignore">
      <xs:choice>
        <xs:sequence>
          <xs:element name="lastName" type="xs:string" minOccurs="0"/>
          <xs:element name="firstName" type="xs:string" minOccurs="0"/>
        </xs:sequence>
        <xs:sequence>
          <xs:element name="firstName" type="xs:string" minOccurs="0"/>
          <xs:element name="lastName" type="xs:string" minOccurs="0"/>
        </xs:sequence>
        <xs:element name="name" type="xs:string" />
      </xs:choice>
    </element>
 
    <element name="date" type="date" style="small" minOccurs="0" notinherit="ignore" heritable="ignore" enclosingName="dates" />

    <element name="link" type="link" style="small" minOccurs="0" maxOccurs="unbounded" />

    <element name="class" type="classification" minOccurs="0" maxOccurs="unbounded" style="select">
      <classification id="Sample_00001" />
    </element>

  </metadata>
</objecttype>